Month,Period,WQU_Project,WQU_Progress,WQU_Completed,MScFE_Course,MScFE_Progress,MScFE_Completed,Additional_Content,Additional_Progress,Additional_Completed,Weekly_Hours_Target,Weekly_Hours_Actual,Monthly_Score,Key_Learnings,Challenges_Faced,Next_Month_Focus
Month 1,Aug 2025,Housing in Mexico,0,False,Financial Markets,0,False,Quantitative Finance Fundamentals,0,False,20,0,0,,,
Month 2,Sep 2025,Apartment Sales in Buenos Aires,0,False,Financial Markets,0,False,Technical Analysis & Portfolio Theory Intro,0,False,20,0,0,,,
Month 3,Oct 2025,Air Quality in Nairobi (Time Series Focus),0,False,Financial Data,0,False,Machine Learning for Finance Intro,0,False,20,0,0,,,
Month 4,Nov 2025,Earthquake Damage in Nepal,0,False,Financial Data,0,False,Statistical Methods for Finance,0,False,20,0,0,,,
Month 5,Dec 2025,Bankruptcy in Poland + Customer Segmentation in US,0,False,Financial Econometrics,0,False,Advanced Portfolio Management,0,False,20,0,0,,,
Month 6,Jan 2026,A/B Testing at WQU + Volatility Forecasting in India,0,False,Financial Econometrics,0,False,Algorithmic Trading Strategies,0,False,20,0,0,,,
Month 7,Feb 2026,Portfolio Project - Algorithmic Trading Strategy,0,False,Derivative Pricing,0,False,Deep Learning for Finance,0,False,20,0,0,,,
Month 8,Mar 2026,Risk Management System Development,0,False,Stochastic Modeling,0,False,Alternative Data & NLP,0,False,20,0,0,,,
Month 9,Apr 2026,Comprehensive Quantitative Finance Project,0,False,Stochastic Modeling,0,False,Career Development & Networking,0,False,20,0,0,,,
